{
  "$schema": "docs/capabilities.schema.json",
  "schemaVersion": 1,
  "mode": "skeleton",
  "name": "react-skeleton",
  "scope": "@skeleton",
  "version": "1.1.0",
  "summary": "React + TypeScript + Vite 프런트 스켈레톤(pnpm 워크스페이스) — 새 프로젝트가 필요한 패키지만 골라 찍어 가는 부품 · 화면 틀 · 패키지 모음. 백엔드는 형제 레포 kotlin-skeleton.",
  "newProject": {
    "react": {
      "script": "scripts/new-project.sh",
      "usage": "scripts/new-project.sh <target-dir> <name> [--packages a,b,c] [--ssr] [--without-storybook] [--with-workbench] [--with-sample] [--scope @acme]",
      "positional": ["target-dir", "name"],
      "flags": [
        "--packages",
        "--ssr",
        "--without-storybook",
        "--with-workbench",
        "--with-sample",
        "--scope"
      ]
    },
    "kotlin": {
      "starterModules": [
        "account",
        "account-jdbc",
        "alert",
        "auth",
        "auth-session",
        "auth-session-jdbc",
        "auth-social",
        "captcha-turnstile",
        "db-postgresql",
        "idempotency",
        "job-queue-jdbc",
        "legal",
        "legal-jdbc",
        "migration",
        "migration-flyway",
        "notification-mail",
        "persistence-jdbc",
        "platform",
        "time"
      ],
      "script": "scripts/new-project.sh",
      "usage": "scripts/new-project.sh <target-dir> <root-package> <config-prefix> <ClassPrefix> [--modules a,b,c] [--db postgresql|mysql] [--with-workbench] [--with-sample] [--dry-run]",
      "positional": ["target-dir", "root-package", "config-prefix", "ClassPrefix"],
      "flags": ["--modules", "--db", "--with-workbench", "--with-sample", "--dry-run"]
    }
  },
  "guides": [
    {
      "path": "docs/new-project-recipe.md",
      "summary": "제품 한 문단 → 고를 것 → 두 레포의 new-project.sh 명령 → 환경변수 → 실행 → 화면마다 복사할 Pattern → 검증 → 배포, 작업 예 3개"
    },
    {
      "path": "docs/ui-catalog.md",
      "summary": "부품 → 스토리 파일 → 언제 쓰는가, 그리고 복사해 시작하는 Patterns 표"
    },
    {
      "path": "docs/design-tokens.md",
      "summary": "디자인 토큰의 층 · 이름 · 추가법"
    },
    {
      "path": "README.md",
      "summary": "레포 개요 · 빠른 시작 · 새 프로젝트 시작"
    }
  ],
  "capabilities": [
    {
      "patterns": [],
      "stories": [],
      "docs": ["packages/api-client/README.md"],
      "entryPoints": [
        "createApiClient",
        "apiConfigFromEnv",
        "ApiRequestError",
        "isErrorCode",
        "ErrorCodes",
        "newIdempotencyKey",
        "createTraceContext"
      ],
      "needs": [],
      "backend": {
        "modules": ["platform"],
        "oneOfModules": [],
        "optionalModules": [],
        "basePaths": ["/api/v1"],
        "docs": ["docs/modules/platform.md", "docs/errors.md"]
      },
      "status": "stable",
      "id": "api-client",
      "kind": "package",
      "package": "@skeleton/api-client",
      "path": "packages/api-client",
      "stampFlag": {
        "flag": null,
        "included": "always",
        "autoIncludes": [],
        "alsoVia": [],
        "optOut": null
      },
      "summary": "백엔드 REST 호출 한 곳 — 응답 envelope 벗기기 · 표준 에러(ApiRequestError · 에러 코드) · traceparent · 멱등 키 · 서버 시각 연결점을 갖춘 클라이언트.",
      "notFor": [
        "실시간 스트림(SSE · WebSocket) → realtime",
        "페이지 · 컴포넌트에서 fetch/axios 를 직접 부르지 않는다 — 앱의 api/client.ts 인스턴스를 훅(useQuery)으로 쓴다"
      ],
      "keywords": {
        "ko": [
          "API 호출",
          "백엔드 연결",
          "에러 처리",
          "에러 코드",
          "멱등 키",
          "traceId",
          "응답 형식"
        ],
        "en": [
          "api client",
          "rest",
          "http client",
          "error codes",
          "idempotency key",
          "trace id",
          "axios"
        ]
      }
    },
    {
      "patterns": [
        "apps/storybook/src/patterns/LoginPage.stories.tsx",
        "apps/storybook/src/patterns/ForbiddenPage.stories.tsx",
        "packages/auth/src/patterns/SignIn.stories.tsx",
        "packages/auth/src/patterns/SignUp.stories.tsx",
        "packages/auth/src/patterns/MailLinkLandings.stories.tsx",
        "packages/auth/src/patterns/DeletionPending.stories.tsx",
        "packages/auth/src/patterns/SocialEmailConflict.stories.tsx",
        "packages/auth/src/patterns/EmailRequired.stories.tsx",
        "packages/auth/src/patterns/LoginIdField.stories.tsx",
        "packages/auth/src/patterns/LoginIdRequired.stories.tsx",
        "packages/auth/src/patterns/AccountSettings.stories.tsx"
      ],
      "stories": [
        "packages/auth/src/RequireAuth.stories.tsx",
        "packages/auth/src/RequirePermission.stories.tsx"
      ],
      "docs": ["packages/auth/README.md"],
      "entryPoints": [
        "createTokenStore",
        "createRefreshStore",
        "createAuthApi",
        "createAuthSession",
        "createSessionRefresher",
        "createAccountApi",
        "createAuthRoutes",
        "AuthProvider",
        "useAuth",
        "RequireAuth",
        "RequireRole",
        "RequirePermission",
        "useCan",
        "SignInScreen",
        "SignUpScreen",
        "AccountSettings",
        "createAuthHeadersProvider",
        "createUnauthorizedHandler"
      ],
      "needs": ["api-client", "ui"],
      "backend": {
        "modules": ["auth"],
        "oneOfModules": [],
        "optionalModules": [
          "account",
          "account-jdbc",
          "auth-session",
          "auth-session-jdbc",
          "auth-magic-link"
        ],
        "basePaths": ["/api/v1/auth", "/api/v1/account"],
        "docs": [
          "docs/modules/auth.md",
          "docs/modules/account.md",
          "docs/modules/auth-session.md",
          "docs/account-http-contract.md"
        ]
      },
      "status": "stable",
      "id": "auth",
      "kind": "package",
      "package": "@skeleton/auth",
      "path": "packages/auth",
      "stampFlag": {
        "flag": null,
        "included": "always",
        "autoIncludes": [],
        "alsoVia": [],
        "optOut": null
      },
      "summary": "로그인 · 계정 수명주기 — 토큰 갱신(401 → 갱신 한 번 → 재시도, 회전 안전 · 탭 락) · 가입(닉네임 칸: 끔 · 선택 · 필수) · 메일 인증 · 비밀번호 재설정 · 링크 로그인 · 소셜 · 계정 설정(비밀번호 · 계정 이메일 · 연락받을 이메일 · 로그인 수단 · 세션 · 삭제) · 이메일을 필수로 켠 앱의 「이메일을 등록해 주세요」 전면 화면(주소 없는 계정이 앱 대신 본다 — 받는 시점은 로그인 직후 또는 쓰기 때, 쓰기 때는 `useEmailBeforeWrite` 와 「나중에 하기」) · 로그인 아이디(서버가 켠 앱만 — 가입의 아이디 칸과 실시간 확인 · 「아이디 또는 이메일」 로그인 · 아이디 찾기 `/forgot-id` · 아이디 없는 계정의 「아이디를 정해 주세요」 막 · 설정의 아이디 줄 · 관리자 표의 아이디 열과 찾기, 키가 없으면 화면은 예전 그대로) · 탈퇴 유예 중 로그인의 「탈퇴를 취소할까요?」 화면과 라우트 한 벌, 방법은 설정으로 켜고 끈다.",
      "notFor": [
        "권한(roles) 정책 자체는 백엔드 — 이 패키지는 토큰 · 라우트 가드(RequireAuth · RequireRole · RequirePermission)만 - 권한 문자열은 백엔드 GET /auth/me 가 주고 화면은 숨길 뿐이다",
        "약관 동의 저장은 없다 — 가입 화면의 동의 슬롯은 체크한 판을 콜백으로 보고할 뿐(문서 · 저장은 @skeleton/legal)",
        "로그인 화면의 모양(색 · 로고 · 문구 톤)은 앱의 몫 — 문구는 labels prop(기본 영어, koAuthLabels 한국어)"
      ],
      "keywords": {
        "ko": [
          "로그인",
          "로그아웃",
          "인증",
          "토큰",
          "JWT",
          "보호 라우트",
          "로그인 상태",
          "세션",
          "회원가입",
          "가입",
          "이메일 인증",
          "비밀번호 재설정",
          "비밀번호 찾기",
          "계정 설정",
          "계정 삭제",
          "탈퇴 취소",
          "탈퇴 유예",
          "토큰 갱신",
          "리프레시 토큰",
          "세션 목록",
          "닉네임",
          "표시 이름",
          "로그인 아이디",
          "아이디 찾기",
          "이메일 쓰기 때 받기"
        ],
        "en": [
          "login",
          "logout",
          "auth",
          "authentication",
          "jwt",
          "token",
          "session",
          "protected route",
          "sign in",
          "sign up",
          "registration",
          "email verification",
          "password reset",
          "forgot password",
          "account settings",
          "delete account",
          "cancel deletion",
          "deletion grace",
          "refresh token",
          "token refresh",
          "active sessions",
          "nickname",
          "display name",
          "login id",
          "username login",
          "find my id",
          "email on write"
        ]
      }
    },
    {
      "patterns": [],
      "stories": [],
      "docs": ["packages/realtime/README.md"],
      "entryPoints": [
        "createSseClient",
        "useSseClient",
        "createStompNotificationClient",
        "useNotificationSocket",
        "websocketUrlFromApiBase"
      ],
      "needs": ["api-client"],
      "backend": {
        "modules": [],
        "oneOfModules": [["notification-sse", "notification-websocket"]],
        "optionalModules": [],
        "basePaths": ["/api/v1/notifications/sse"],
        "docs": ["docs/modules/notification-sse.md", "docs/modules/notification-websocket.md"]
      },
      "status": "stable",
      "id": "realtime",
      "kind": "package",
      "package": "@skeleton/realtime",
      "path": "packages/realtime",
      "stampFlag": {
        "flag": "--packages realtime",
        "included": "flag",
        "autoIncludes": ["api-client", "auth", "legal", "theme", "time", "tokens", "ui"],
        "alsoVia": ["--with-sample", "--with-workbench"],
        "optOut": null
      },
      "summary": "서버가 밀어 주는 실시간 연결 — SSE(탭 숨김 일시정지 · 유휴 감시 · 재연결)와 STOMP WebSocket 알림 클라이언트.",
      "notFor": [
        "알림 목록 · 안 읽은 수 화면 → notifications (이 패키지는 연결만 맡는다)",
        "일반 REST 호출 → api-client"
      ],
      "keywords": {
        "ko": ["실시간", "실시간 알림", "SSE", "웹소켓", "푸시", "연결 유지"],
        "en": [
          "realtime",
          "sse",
          "server-sent events",
          "websocket",
          "stomp",
          "push",
          "live updates"
        ]
      }
    },
    {
      "patterns": [],
      "stories": [
        "packages/i18n/src/I18nProvider.stories.tsx",
        "packages/ui/src/LanguageMenu/LanguageMenu.stories.tsx"
      ],
      "docs": ["packages/i18n/README.md"],
      "entryPoints": [
        "createI18n",
        "I18nProvider",
        "useT",
        "detectLocale",
        "@skeleton/i18n/testing#catalogProblems"
      ],
      "needs": [],